{
  "$schema": "./binding.schema.json",
  "component": "RadioGroup",
  "contract": "../../contracts/components/RadioGroup/RadioGroup.contract.json",
  "framework": "react",
  "refTarget": "root",
  "classNamePassthrough": "root",
  "notes": [
    "Renders a plain `<div>` carrying `role=\"radiogroup\"` rather than a `<fieldset>`. A fieldset brings a legend, and the group's name comes from the consumer here.",
    "The selection is shared with items through React context. That is a React mechanism, not a contract fact.",
    "The keyboard model is generated from `collection.navigation` and executed by `useLinearNavigation` from `@ds/react/behavior` — an imported dependency, not copied code. The context additionally carries `register`/`unregister`/`isTabStop`, which is how this backend learns which DOM nodes its members are. That protocol is a React invention; the conformance cases in `@ds/contracts/conformance/linear-navigation.json` are what keep a second backend's different invention equivalent."
  ]
}
